{
  "run_id": "2026-08-07-breadth-tier-haiku-r2",
  "date": "2026-08-07T22:33:07.069409+00:00",
  "plugin": "agent-fleet",
  "plugin_version": "1.0.2",
  "question": "Does the breadth-fleet model tier (haiku vs sonnet) change citation fidelity and key-fact recall under closed schema and read-only containment?",
  "variable": "breadth agent model",
  "arm": "haiku",
  "batch_id": "2026-08-07-breadth-tier",
  "eval_ref": "bench/plugins/agent-fleet/evals/plasma67-citations.json",
  "eval_sha256": "058df2a583bb504eb25e4af9eab429399fe48c0c72397dab0b57c859ec516948",
  "harness": {
    "orchestrator_model": "claude-fable-5",
    "claude_code_version": "2.1.223 (Claude Code)",
    "workflow_run_id": "wf_2bcac8f9-862",
    "session_effort": "xhigh"
  },
  "agents": [
    {
      "agent_id": "a3b8a112816010113",
      "label": null,
      "phase": "breadth",
      "model": "claude-haiku-4-5-20251001",
      "agent_type": "Explore",
      "prompt_sha256": "5bbb6f8890be1a16a6bf95c77da7d4464696dd85c2300c830f043b65844ca5ea",
      "prompt_head": "When was (or will be) KDE Plasma 6.7 released, and what is its 6.7.x bugfix schedule? Fetch the kde.org announcement for Plasma 6.7.0 and the announcements list",
      "tokens": {
        "output": 3650,
        "input_uncached": 136,
        "cache_write": 38384,
        "cache_read": 440845
      },
      "tool_calls": 16,
      "duration_ms": 87297,
      "api_calls": 16
    },
    {
      "agent_id": "a5e73b8dc55bced1b",
      "label": null,
      "phase": "breadth",
      "model": "claude-haiku-4-5-20251001",
      "agent_type": "Explore",
      "prompt_sha256": "554d7cd14ea0729969ebdbd50d3ddf2eba208dd994599eb40bdb694045e63ca3",
      "prompt_head": "Does KDE Plasma 6.7 include per-monitor (per-screen) virtual desktops — a different virtual desktop on each monitor? Fetch the official Plasma 6.7.0 announcemen",
      "tokens": {
        "output": 4165,
        "input_uncached": 158,
        "cache_write": 57750,
        "cache_read": 669823
      },
      "tool_calls": 18,
      "duration_ms": 97799,
      "api_calls": 19
    },
    {
      "agent_id": "abe74f6eccc9a6ff6",
      "label": null,
      "phase": "breadth",
      "model": "claude-haiku-4-5-20251001",
      "agent_type": "Explore",
      "prompt_sha256": "33e7785927e17008e3859765c8c4b2320f0fa07adba665771c608b28754a4654",
      "prompt_head": "What plasma-desktop version does the Kubuntu Backports PPA currently publish for Ubuntu 26.04 (Resolute)? Fetch https://launchpad.net/~kubuntu-ppa/+archive/ubun",
      "tokens": {
        "output": 4813,
        "input_uncached": 168,
        "cache_write": 41025,
        "cache_read": 634150
      },
      "tool_calls": 20,
      "duration_ms": 88446,
      "api_calls": 20
    },
    {
      "agent_id": "ad2e12d305aeef82b",
      "label": null,
      "phase": "breadth",
      "model": "claude-haiku-4-5-20251001",
      "agent_type": "Explore",
      "prompt_sha256": "3549039253dc3abb57b21f0cf39c05f219032d05b7f7c500ca00bda28fba3b64",
      "prompt_head": "What is the status of KDE bug 107302 (https://bugs.kde.org/show_bug.cgi?id=107302), and which Plasma version fixed it? Fetch the bug page. Return the bug title,",
      "tokens": {
        "output": 815,
        "input_uncached": 56,
        "cache_write": 28011,
        "cache_read": 131480
      },
      "tool_calls": 6,
      "duration_ms": 34679,
      "api_calls": 6
    },
    {
      "agent_id": "af1e44f499594bca4",
      "label": null,
      "phase": "breadth",
      "model": "claude-haiku-4-5-20251001",
      "agent_type": "Explore",
      "prompt_sha256": "cad03d15cbda02295880d06e7917f817fe0f7e39942bafec622e1a7021d23261",
      "prompt_head": "Which plasma-desktop version does Ubuntu 26.10 (Stonking) currently carry? Fetch https://packages.ubuntu.com/stonking/plasma-desktop and https://launchpad.net/u",
      "tokens": {
        "output": 1364,
        "input_uncached": 52,
        "cache_write": 51915,
        "cache_read": 144526
      },
      "tool_calls": 7,
      "duration_ms": 31211,
      "api_calls": 6
    }
  ],
  "untracked_agents": [],
  "totals": {
    "output": 14807,
    "input_uncached": 570,
    "cache_write": 217085,
    "cache_read": 2020824,
    "tool_calls": 67,
    "wall_duration_ms": 97800
  },
  "outcomes": {
    "verifier_self_test": true,
    "citations": {
      "source": "script",
      "measured": 17,
      "found": 14,
      "partial": 1,
      "absent": 2,
      "unfetchable_quotes": 2,
      "found_rate": 0.824,
      "wrong_source": 0
    },
    "assertions": {
      "source": "script",
      "schema_ok": 5,
      "schema_total": 5,
      "key_fact_score": 4,
      "key_fact_total": 5,
      "per_item": {
        "schedule": {
          "schema_ok": true,
          "key_fact": true,
          "findings": 6,
          "found": 5
        },
        "feature": {
          "schema_ok": true,
          "key_fact": true,
          "findings": 3,
          "found": 3
        },
        "tracker": {
          "schema_ok": true,
          "key_fact": false,
          "findings": 3,
          "found": 3
        },
        "backports": {
          "schema_ok": true,
          "key_fact": true,
          "findings": 4,
          "found": 2
        },
        "distro": {
          "schema_ok": true,
          "key_fact": true,
          "findings": 3,
          "found": 1
        }
      }
    }
  },
  "notes": "Round 2 of 5, batch 2026-08-07-breadth-tier. Known eval design weakness, applies equally to both arms: tracker key_fact_regexes require the bug number in claim+quote text; whether an agent restates the number there is a stylistic choice (measured: some runs do, some leave it only in the url field), so key_fact:tracker conflates fact recall with that choice. Queue for eval v2 after this batch. ",
  "orchestrator_prompt_sha256": "4acdd37465656c63b01b60ec9b206da91cae5aef656f3823700954aab3dedb8c"
}
