{
 "run_id": "2026-08-18-docker-source-mix-web-pilot",
 "date": "2026-08-18T15:08:47.295026+00:00",
 "plugin": "agent-fleet",
 "plugin_version": "1.0.8",
 "question": "On a product-comparison question (Docker vs Podman), what mix of source venues does a five-angle WebSearch/WebFetch fan-out actually surface?",
 "variable": "none",
 "arm": "pilot",
 "batch_id": null,
 "eval_ref": null,
 "eval_sha256": null,
 "harness": {
  "orchestrator_model": "claude-opus-5",
  "claude_code_version": "2.1.234 (Claude Code)",
  "workflow_run_id": null,
  "session_effort": null
 },
 "agents": [
  {
   "agent_id": "a31ca89f23bc6eeb4",
   "label": null,
   "phase": "retrieval",
   "model": "claude-haiku-4-5-20251001",
   "agent_type": "general-purpose",
   "prompt_sha256": "7780a5821815fe29700b304a35a3a85b9a4ddb92de7dcce87741c48292b4918f",
   "prompt_head": "Pesquisa: Docker vs Podman. SEU \u00c2NGULO: compatibilidade de docker-compose, podman-compose e quadlet \u2014 onde falha.\n\nPASSO 0: rode `date +%s.%N` via Bash \u2192 t_star",
   "tokens": {
    "output": 3724,
    "input_uncached": 972,
    "cache_write": 25749,
    "cache_read": 275725
   },
   "tool_calls": 9,
   "duration_ms": 78347,
   "api_calls": 7
  },
  {
   "agent_id": "a6ff05aa19359ca18",
   "label": null,
   "phase": "retrieval",
   "model": "claude-haiku-4-5-20251001",
   "agent_type": "general-purpose",
   "prompt_sha256": "ebb68e0c96a4e59d52c0b9880a03ed2f688a3f459a02e8cbf01fdf0df2c9f36b",
   "prompt_head": "Pesquisa: Docker vs Podman. SEU \u00c2NGULO: overhead de recursos e desempenho, com n\u00fameros medidos.\n\nPASSO 0: rode `date +%s.%N` via Bash \u2192 t_start.\nPASSO 1: use We",
   "tokens": {
    "output": 4206,
    "input_uncached": 70,
    "cache_write": 26216,
    "cache_read": 320872
   },
   "tool_calls": 10,
   "duration_ms": 82473,
   "api_calls": 8
  },
  {
   "agent_id": "a78fb84d0a757fc56",
   "label": null,
   "phase": "retrieval",
   "model": "claude-haiku-4-5-20251001",
   "agent_type": "general-purpose",
   "prompt_sha256": "01931d9db4e8a7b828625eb36001e01e08edfa5a31a3d96d411a2436a3df0f1e",
   "prompt_head": "Pesquisa: Docker vs Podman. SEU \u00c2NGULO: rootless e superf\u00edcie de seguran\u00e7a em produ\u00e7\u00e3o.\n\nPASSO 0: rode `date +%s.%N` via Bash \u2192 t_start.\nPASSO 1: use WebSearch ",
   "tokens": {
    "output": 4062,
    "input_uncached": 184,
    "cache_write": 50330,
    "cache_read": 258453
   },
   "tool_calls": 9,
   "duration_ms": 118440,
   "api_calls": 7
  },
  {
   "agent_id": "a87276cb62986ca98",
   "label": null,
   "phase": "retrieval",
   "model": "claude-haiku-4-5-20251001",
   "agent_type": "general-purpose",
   "prompt_sha256": "2f48f9f745986b3ab08bb3854592e36dd3cddbbd3e3cb13da2ba921d8614b1dd",
   "prompt_head": "Pesquisa: Docker vs Podman. SEU \u00c2NGULO: experi\u00eancia real de quem migrou de Docker para Podman e o que quebrou na pr\u00e1tica.\n\nPASSO 0: rode `date +%s.%N` via Bash ",
   "tokens": {
    "output": 5014,
    "input_uncached": 52,
    "cache_write": 28128,
    "cache_read": 232040
   },
   "tool_calls": 8,
   "duration_ms": 86695,
   "api_calls": 6
  },
  {
   "agent_id": "abd711d21cb7afe5c",
   "label": null,
   "phase": "retrieval",
   "model": "claude-haiku-4-5-20251001",
   "agent_type": "general-purpose",
   "prompt_sha256": "7cd5e71a5ed337f0ccbc71cc3591c273c29c6483999263e4f1524706d353d302",
   "prompt_head": "Pesquisa: Docker vs Podman. SEU \u00c2NGULO: licenciamento e custo do Docker Desktop como motivador de migra\u00e7\u00e3o.\n\nPASSO 0: rode `date +%s.%N` via Bash \u2192 t_start.\nPAS",
   "tokens": {
    "output": 4484,
    "input_uncached": 60,
    "cache_write": 26474,
    "cache_read": 277310
   },
   "tool_calls": 11,
   "duration_ms": 84690,
   "api_calls": 7
  }
 ],
 "untracked_agents": [],
 "totals": {
  "output": 21490,
  "input_uncached": 1338,
  "cache_write": 156897,
  "cache_read": 1364400,
  "tool_calls": 47,
  "wall_duration_ms": 118440
 },
 "outcomes": {
  "source": "orchestrator_assertion",
  "verifier_self_test": null,
  "angles": 5,
  "urls_returned_by_search": 75,
  "urls_owned_by_either_tool_vendor": 5,
  "sources_fetched": 14,
  "fetch_failures": 2,
  "venue_mix": {
   "commercial_or_independent_blog": 10,
   "tool_vendor": 2,
   "aggregator": 1,
   "dev.to_post": 1,
   "practitioner_venue_forum_issue_or_list": 0
  },
  "vendor_page_consulted_for_published_pricing": false,
  "quote_did_not_support_its_claim": 1,
  "unflagged_tension_between_two_sources_seen_by_one_agent": 1
 },
 "notes": "The venue labels are each agent's own self-report, not an independent classification \u2014 three of the domains counted as independent blogs (uptrace.dev, last9.io, qovery.com) were separately confirmed by the orchestrator to be commercial product sites, so 'practitioner_venue = 0' is the reliable figure and the blog/commercial split is soft. Pricing note: no agent fetched docker.com; the fleet reported $9 and $15 per user per month without the annual-commitment qualifier (docker.com/pricing, fetched same day: Pro $9 annual / $11 monthly, Team $15 / $16, Business $24). PROTOCOL DEVIATIONS. (1) Ad-hoc Agent-tool fan-out, not a Workflow: harness.workflow_run_id is null and there is no orchestrator prompt hash, so this run cannot be mechanically paired with any other. (2) n=1 \u2014 below the protocol floor of 5 runs per arm. (3) No frozen eval set; eval_ref and eval_sha256 are null. (4) No mechanical verifier ran, so outcomes.verifier_self_test is null and every outcome is tagged orchestrator_assertion \u2014 counted by the orchestrator from each agent's returned report, not string-checked against the pages. Recorded as arm 'pilot' / variable 'none' because every candidate pairing in this batch differs in more than one variable, which the protocol forbids for an arm."
}
