{
 "run_id": "2026-08-18-docker-source-mix-reddit-pilot",
 "date": "2026-08-18T15:08:47.346058+00:00",
 "plugin": "agent-fleet",
 "plugin_version": "1.0.8",
 "question": "Same five angles retrieved from Reddit threads through the Chrome MCP: what does the practitioner-venue channel return, and do independently-tasked agents converge on the same threads?",
 "variable": "none",
 "arm": "pilot",
 "batch_id": null,
 "eval_ref": null,
 "eval_sha256": null,
 "harness": {
  "orchestrator_model": "claude-opus-5",
  "claude_code_version": "2.1.234 (Claude Code)",
  "workflow_run_id": null,
  "session_effort": null
 },
 "agents": [
  {
   "agent_id": "a04d089335fe1e158",
   "label": null,
   "phase": "retrieval",
   "model": "claude-haiku-4-5-20251001",
   "agent_type": "general-purpose",
   "prompt_sha256": "a7f89e75885b8b47465c37bcacccff8dd1a06cd8b8a8580af9c2ccfdebe63758",
   "prompt_head": "Pesquisa DENTRO do Reddit, pelo Chrome. Tema: Docker vs Podman. SEU \u00c2NGULO: quem migrou de Docker para Podman e o que quebrou.\n\nPASSO 0: `date +%s.%N` via Bash ",
   "tokens": {
    "output": 4366,
    "input_uncached": 124,
    "cache_write": 56779,
    "cache_read": 787359
   },
   "tool_calls": 14,
   "duration_ms": 103428,
   "api_calls": 15
  },
  {
   "agent_id": "a204e59051ca93afb",
   "label": null,
   "phase": "retrieval",
   "model": "claude-haiku-4-5-20251001",
   "agent_type": "general-purpose",
   "prompt_sha256": "2714418a6404282b10393096919cbf619001378f31f6370a08b13c851ad0a457",
   "prompt_head": "Pesquisa DENTRO do Reddit, pelo Chrome. Tema: Docker vs Podman. SEU \u00c2NGULO: compose, podman-compose e quadlet \u2014 onde falha.\n\nPASSO 0: `date +%s.%N` via Bash \u2192 t",
   "tokens": {
    "output": 7600,
    "input_uncached": 116,
    "cache_write": 61073,
    "cache_read": 749764
   },
   "tool_calls": 15,
   "duration_ms": 129300,
   "api_calls": 14
  },
  {
   "agent_id": "a4531e16b895dd64c",
   "label": null,
   "phase": "retrieval",
   "model": "claude-haiku-4-5-20251001",
   "agent_type": "general-purpose",
   "prompt_sha256": "f655cb15542209d79cc6e2ddcf2c79fbc2f41e9f14dd6cd78e01094f81520b2b",
   "prompt_head": "Pesquisa DENTRO do Reddit, pelo Chrome. Tema: Docker vs Podman. SEU \u00c2NGULO: licenciamento e custo do Docker Desktop como motivo de troca.\n\nPASSO 0: `date +%s.%N",
   "tokens": {
    "output": 5667,
    "input_uncached": 156,
    "cache_write": 90092,
    "cache_read": 1199930
   },
   "tool_calls": 18,
   "duration_ms": 139176,
   "api_calls": 19
  },
  {
   "agent_id": "a6c76c3cdbcfd39c6",
   "label": null,
   "phase": "retrieval",
   "model": "claude-haiku-4-5-20251001",
   "agent_type": "general-purpose",
   "prompt_sha256": "1d4334ccf7c5db225a0035670ed1a6be3a636383883ace1f2eb48bd958825b7a",
   "prompt_head": "Pesquisa DENTRO do Reddit, pelo Chrome. Tema: Docker vs Podman. SEU \u00c2NGULO: overhead de recursos e desempenho.\n\nPASSO 0: `date +%s.%N` via Bash \u2192 t_start.\n\nPASS",
   "tokens": {
    "output": 6789,
    "input_uncached": 140,
    "cache_write": 59530,
    "cache_read": 945578
   },
   "tool_calls": 16,
   "duration_ms": 142966,
   "api_calls": 17
  },
  {
   "agent_id": "af09d6663869f3dd7",
   "label": null,
   "phase": "retrieval",
   "model": "claude-haiku-4-5-20251001",
   "agent_type": "general-purpose",
   "prompt_sha256": "e658cee5b08d47fa7824d6c72e1877830bdb7a38eed273b18241e3e3852f45d6",
   "prompt_head": "Pesquisa DENTRO do Reddit, pelo Chrome. Tema: Docker vs Podman. SEU \u00c2NGULO: rootless e seguran\u00e7a em produ\u00e7\u00e3o.\n\nPASSO 0: `date +%s.%N` via Bash \u2192 t_start.\n\nPASSO",
   "tokens": {
    "output": 5174,
    "input_uncached": 166,
    "cache_write": 70493,
    "cache_read": 1171011
   },
   "tool_calls": 20,
   "duration_ms": 137419,
   "api_calls": 20
  }
 ],
 "untracked_agents": [],
 "totals": {
  "output": 29596,
  "input_uncached": 702,
  "cache_write": 337967,
  "cache_read": 4853642,
  "tool_calls": 83,
  "wall_duration_ms": 171306
 },
 "outcomes": {
  "source": "orchestrator_assertion",
  "verifier_self_test": null,
  "angles": 5,
  "distinct_tab_ids": 5,
  "hard_error": 0,
  "thread_reads": 10,
  "distinct_threads": 7,
  "most_reread_thread": {
   "id": "1swwbg6",
   "read_by_n_agents": 3,
   "from_n_distinct_angles": 3
  },
  "same_author_and_quote_returned_by_n_agents": 3,
  "echo_field_filled_with_search_url_instead_of_thread_url": 3,
  "quotes_truncated_mid_sentence_by_15_word_cap": true
 },
 "notes": "Convergence is the finding: 10 reads yielded 7 distinct threads and one thread was read by 3 agents working 3 different angles, which would read as three-source corroboration to a synthesis stage. Two of five agents also deviated from the given site-wide search URL and narrowed to /r/podman/, which plausibly drove part of the convergence \u2014 so the convergence figure is confounded by agent deviation and is not a clean property of the channel. PROTOCOL DEVIATIONS. (1) Ad-hoc Agent-tool fan-out, not a Workflow: harness.workflow_run_id is null and there is no orchestrator prompt hash, so this run cannot be mechanically paired with any other. (2) n=1 \u2014 below the protocol floor of 5 runs per arm. (3) No frozen eval set; eval_ref and eval_sha256 are null. (4) No mechanical verifier ran, so outcomes.verifier_self_test is null and every outcome is tagged orchestrator_assertion \u2014 counted by the orchestrator from each agent's returned report, not string-checked against the pages. Recorded as arm 'pilot' / variable 'none' because every candidate pairing in this batch differs in more than one variable, which the protocol forbids for an arm."
}
