{
 "run_id": "2026-08-18-chrome-handle-own-pilot",
 "date": "2026-08-18T15:08:47.249233+00:00",
 "plugin": "agent-fleet",
 "plugin_version": "1.0.8",
 "question": "Does the same five-agent Chrome fan-out run clean when each agent creates its own tab with tabs_create_mcp and passes its tabId explicitly on every subsequent call?",
 "variable": "none",
 "arm": "pilot",
 "batch_id": null,
 "eval_ref": null,
 "eval_sha256": null,
 "harness": {
  "orchestrator_model": "claude-opus-5",
  "claude_code_version": "2.1.234 (Claude Code)",
  "workflow_run_id": null,
  "session_effort": null
 },
 "agents": [
  {
   "agent_id": "a494e8badb42b6ce3",
   "label": null,
   "phase": "retrieval",
   "model": "claude-sonnet-5",
   "agent_type": "general-purpose",
   "prompt_sha256": "190712b19097cd55ab15047f27af5dad3f8e96356b257f100e5d947a1ca1422d",
   "prompt_head": "Teste de concorr\u00eancia do MCP do Chrome. Pergunta sob teste: v\u00e1rios subagentes conseguem dirigir o Chrome ao mesmo tempo, cada um na SUA PR\u00d3PRIA aba?\n\nPASSO 0: r",
   "tokens": {
    "output": 5713,
    "input_uncached": 16,
    "cache_write": 39103,
    "cache_read": 456834
   },
   "tool_calls": 8,
   "duration_ms": 78956,
   "api_calls": 8
  },
  {
   "agent_id": "a4bd74e80c2fb73b1",
   "label": null,
   "phase": "retrieval",
   "model": "claude-sonnet-5",
   "agent_type": "general-purpose",
   "prompt_sha256": "b034da2b95befd624bb26bb4f692ac882e61c91cecc710c89e4687afedfdef02",
   "prompt_head": "Teste de concorr\u00eancia do MCP do Chrome. Pergunta sob teste: v\u00e1rios subagentes conseguem dirigir o Chrome ao mesmo tempo, cada um na SUA PR\u00d3PRIA aba?\n\nPASSO 0: r",
   "tokens": {
    "output": 5279,
    "input_uncached": 16,
    "cache_write": 40096,
    "cache_read": 458215
   },
   "tool_calls": 8,
   "duration_ms": 75140,
   "api_calls": 8
  },
  {
   "agent_id": "a4fee33f4953e8d58",
   "label": null,
   "phase": "retrieval",
   "model": "claude-sonnet-5",
   "agent_type": "general-purpose",
   "prompt_sha256": "cb171bc9089b246c5f9e5d88106e2ef472338ee79e71e605ce45f06931658e18",
   "prompt_head": "Teste de concorr\u00eancia do MCP do Chrome. Pergunta sob teste: v\u00e1rios subagentes conseguem dirigir o Chrome ao mesmo tempo, cada um na SUA PR\u00d3PRIA aba?\n\nPASSO 0: r",
   "tokens": {
    "output": 5008,
    "input_uncached": 16,
    "cache_write": 41080,
    "cache_read": 464275
   },
   "tool_calls": 8,
   "duration_ms": 103415,
   "api_calls": 8
  },
  {
   "agent_id": "a536bd974df41ea1e",
   "label": null,
   "phase": "retrieval",
   "model": "claude-sonnet-5",
   "agent_type": "general-purpose",
   "prompt_sha256": "08816153406239892a56989071f5b4758020ba6f12e539c4f47f7e5964119765",
   "prompt_head": "Teste de concorr\u00eancia do MCP do Chrome. Pergunta sob teste: v\u00e1rios subagentes conseguem dirigir o Chrome ao mesmo tempo, cada um na SUA PR\u00d3PRIA aba?\n\nPASSO 0: r",
   "tokens": {
    "output": 4749,
    "input_uncached": 16,
    "cache_write": 38368,
    "cache_read": 449272
   },
   "tool_calls": 8,
   "duration_ms": 68691,
   "api_calls": 8
  },
  {
   "agent_id": "aed5f66aa1238f578",
   "label": null,
   "phase": "retrieval",
   "model": "claude-sonnet-5",
   "agent_type": "general-purpose",
   "prompt_sha256": "175cf2b836e6eb784db8064f8a5795c76755a6141706a1c5e746f068db22bfa3",
   "prompt_head": "Teste de concorr\u00eancia do MCP do Chrome. Pergunta sob teste: v\u00e1rios subagentes conseguem dirigir o Chrome ao mesmo tempo, cada um na SUA PR\u00d3PRIA aba?\n\nPASSO 0: r",
   "tokens": {
    "output": 7474,
    "input_uncached": 16,
    "cache_write": 40215,
    "cache_read": 456746
   },
   "tool_calls": 8,
   "duration_ms": 99074,
   "api_calls": 8
  }
 ],
 "untracked_agents": [],
 "totals": {
  "output": 28223,
  "input_uncached": 80,
  "cache_write": 198862,
  "cache_read": 2285342,
  "tool_calls": 40,
  "wall_duration_ms": 119837
 },
 "outcomes": {
  "source": "orchestrator_assertion",
  "verifier_self_test": null,
  "agents": 5,
  "distinct_tab_ids": 5,
  "requested_url_equals_read_url": 5,
  "hard_error": 0,
  "silent_cross_contamination": 0,
  "comment_authors_extracted": 0,
  "extraction_caveat": "max_chars 3000 truncated before the comment region on every agent, so this run demonstrates correct page identity, NOT comment extraction"
 },
 "notes": "Confirms isolation holds under explicit per-agent tab acquisition; does not confirm content extraction (see extraction_caveat). Not pairable with the shared-handle pilot: model also differs. PROTOCOL DEVIATIONS. (1) Ad-hoc Agent-tool fan-out, not a Workflow: harness.workflow_run_id is null and there is no orchestrator prompt hash, so this run cannot be mechanically paired with any other. (2) n=1 \u2014 below the protocol floor of 5 runs per arm. (3) No frozen eval set; eval_ref and eval_sha256 are null. (4) No mechanical verifier ran, so outcomes.verifier_self_test is null and every outcome is tagged orchestrator_assertion \u2014 counted by the orchestrator from each agent's returned report, not string-checked against the pages. Recorded as arm 'pilot' / variable 'none' because every candidate pairing in this batch differs in more than one variable, which the protocol forbids for an arm."
}
